attraction_rank,attraction_name,attraction_url,attraction_city,attraction_rating,comment_title,comment_rating,comment_content,comment_date,comment_user,comment_image_count
11,恭王府,https://travel.qunar.com/p-oi715478-gongwangfu,北京,4.7,,0,恭王府就是福气财气集结地。值得一去。,2015-08-21,brave0915,3
11,恭王府,https://travel.qunar.com/p-oi715478-gongwangfu,北京,4.7,,0,有时间可以观澜墅看看，一边滑雪，一边钓鱼，晚上可以泡温泉,2020-12-06,detx3612,1
11,恭王府,https://travel.qunar.com/p-oi715478-gongwangfu,北京,4.7,整体行程感觉不错。相对自己出行还有一个最大的优势就是导游详细的讲解。照片很多，个人照片就不晒了,0,整体行程感觉不错。原本想自己走这条线路，因为父母在身边，还是考虑跟团会比较方便，事实证明也是如此。导游小夏很专业。从出发前对行程的介绍到出发后一路对团员的组织很到位。相对自己出行还有一个最大的优势就是导游详细的讲解。司机李师傅开车也很稳。一开始还担心老人会晕车，实际上也没有出现不适。最后讲一下这条线路的设定。昨天来北京，先转过了天安门一圈。今天从东四门地铁站出发游完长城、...,2020-11-14,mqyp5662,1
11,恭王府,https://travel.qunar.com/p-oi715478-gongwangfu,北京,4.7,,0,恭王府挺好玩，夏天去实在太热了，但是荷花正待时，景色宜人～,2016-08-11,zps0306,3
11,恭王府,https://travel.qunar.com/p-oi715478-gongwangfu,北京,4.7,,0,还不错，周边很热闹，小吃也很多！跟着免费的导游走了一圈，记得摸福字！,2015-07-11,去哪儿用户,3
11,恭王府,https://travel.qunar.com/p-oi715478-gongwangfu,北京,4.7,十年前恭王府刚刚对外开放，我来游览，只觉好大一个宅子尔尔,0,备课恭王府，历经半年修葺，今天第一天重新营业，人不多。十年前恭王府刚刚对外开放，我来游览，只觉好大一个宅子尔尔。如今再次走进这所宅子，已经明白了她不同寻常的过往。时间，才是一面镜子，它能清晰的让人看见变与不变。,2019-03-20,去哪儿用户,3
11,恭王府,https://travel.qunar.com/p-oi715478-gongwangfu,北京,4.7,恭王府花园值得一看。建议用一天时间玩耍。直接刷身份证就可以了。省了排队的烦恼，很方便,0,省了排队的烦恼，很方便。直接刷身份证就可以了。恭王府花园值得一看。各种珍宝更是没得说。游完王府，外面不远就是什刹海，吃喝玩乐，一体化。建议用一天时间玩耍。跟前地铁交通很方便！,2016-09-17,去哪儿用户,3
11,恭王府,https://travel.qunar.com/p-oi715478-gongwangfu,北京,4.7,还有这家的导游态度也非常好，在地铁口接的我们。恭王府是一个值得去的地方。真的不错！不错,0,恭王府是一个值得去的地方。真的不错！出去玩我建议大家真的需要找个讲解的。之前去颐和园，故宫都是自由行。很多地方也只是随走随看了。里面很多典故都不知道。还有这家的导游态度也非常好，在地铁口接的我们。我妈妈过了60还给我退了差额。不错！,2018-05-23,去哪儿用户,3
11,恭王府,https://travel.qunar.com/p-oi715478-gongwangfu,北京,4.7,,0,很有年代感，正经八百的四合院，威严，气派，取票方便。,2018-08-13,wonder1020,2
11,恭王府,https://travel.qunar.com/p-oi715478-gongwangfu,北京,4.7,恭王府,0,终于有机会来见识一下恭王府啦，暑期过来的简直了，人实在是太多了，可以说是人挤人，恭王府倒是很好预约的，终于能有机会见识和珅的老宅了，而且这里还是还珠格格的拍摄地哈哈，地方其实不是很大，但是要看那个福碑必须得排队，所以玩起来也得俩小时。,2024-08-25,qazj7252,2
11,恭王府,https://travel.qunar.com/p-oi715478-gongwangfu,北京,4.7,,0,行程安排的比较合理，玩起来不会累，导游讲解也很好，中巴车也干净，很棒的体验,2021-02-13,fclc9777,3
11,恭王府,https://travel.qunar.com/p-oi715478-gongwangfu,北京,4.7,,0,历史迷的我很喜欢，不错的推荐，一座恭王府，半部清朝史,2019-05-17,去哪儿用户,3
11,恭王府,https://travel.qunar.com/p-oi715478-gongwangfu,北京,4.7,,0,是我最喜欢的一个园子，就是暑假人太多,2016-07-25,qunar_99common,3
11,恭王府,https://travel.qunar.com/p-oi715478-gongwangfu,北京,4.7,,0,值得一去，来北京旅游就找这种便宜又方便的的方式，和请导游一样,2020-11-06,_微拉,2
11,恭王府,https://travel.qunar.com/p-oi715478-gongwangfu,北京,4.7,,0,取票方便。  恭王府也确实值得一去！,2015-08-26,cxtr1953,1
11,恭王府,https://travel.qunar.com/p-oi715478-gongwangfu,北京,4.7,,0,懂导特别贴心，讲解有趣，性价比超高，,2020-11-17,oqcx2497,3
11,恭王府,https://travel.qunar.com/p-oi715478-gongwangfu,北京,4.7,上周去北京又去恭王府了，比过年去的时候有生气多了，植被现在很茂盛，后花园各种花花草草，真的很棒...,0,上周去北京又去恭王府了，比过年去的时候有生气多了，植被现在很茂盛，后花园各种花花草草，真的很棒哦，恭王府是和珅的府邸，后来查封了，他儿子住一半，王爷住一半,2018-06-04,daodaoquna,3
11,恭王府,https://travel.qunar.com/p-oi715478-gongwangfu,北京,4.7,,0,恭王府非常值得一看，但是一定要有讲解，会比较有趣。,2018-01-18,vmjr6435,2
11,恭王府,https://travel.qunar.com/p-oi715478-gongwangfu,北京,4.7,,0,去的挺早，人还不算多，取票很方便。外面太阳很晒，恭王府里很凉爽?,2015-10-03,uwpj3016,3
11,恭王府,https://travel.qunar.com/p-oi715478-gongwangfu,北京,4.7,就是有些地方还没扩张好，还有就是里面现在比较商业化，不过来北京恭王府是值得的,0,还不错，值得一去，来北京应该去的地方，听一些导游讲一些关于和坤的故事，很有趣，周围的胡同有吃有喝，价钱上也不是很贵。普通消费可以，景点也还不错。就是有些地方还没扩张好，还有就是里面现在比较商业化，不过来北京恭王府是值得的,2015-09-19,,3
11,恭王府,https://travel.qunar.com/p-oi715478-gongwangfu,北京,4.7,,0,人超级多！！！取票很方便，就是排队累人！走到哪都是人！,2015-09-05,去哪儿用户,2
11,恭王府,https://travel.qunar.com/p-oi715478-gongwangfu,北京,4.7,,0,景点不是很大，挺精致的特别喜欢福字艺术,2015-10-25,去哪儿用户,1
11,恭王府,https://travel.qunar.com/p-oi715478-gongwangfu,北京,4.7,,0,总体来说是不错的，唯独那人啊……黑压压哒！,2016-08-30,hyds8694,3
11,恭王府,https://travel.qunar.com/p-oi715478-gongwangfu,北京,4.7,,0,好玩，值得一去，坐地铁北海北下车！,2015-04-28,oevl9691,3
11,恭王府,https://travel.qunar.com/p-oi715478-gongwangfu,北京,4.7,...人数不多，但郭导丝毫没有偷懒，把经典讲解的特别通透，感谢名都国旅，强烈推荐，下次来北京还选这家,0,今天的旅游体验特别好，特别表扬小郭导游，业务熟练讲解生动而且特别认真负责，服务热情周到，让我们外地的游客感受到了北京的温暖，虽然现在特殊时期团队人数不多，但郭导丝毫没有偷懒，把经典讲解的特别通透，感谢名都国旅，强烈推荐，下次来北京还选这家。,2021-03-02,去哪儿用户,3
11,恭王府,https://travel.qunar.com/p-oi715478-gongwangfu,北京,4.7,,0,价格合适，导游不错介绍挺好,2020-12-20,ngfv8832,3
11,恭王府,https://travel.qunar.com/p-oi715478-gongwangfu,北京,4.7,和珅府还是不错的，有自己的特色，之前听导游说，刚建国前北京城里的王府就有三千多间，为了发展都被毁掉了,0,取票方便，入园也可以刷身份证，省下了不少时间。和珅府还是不错的，有自己的特色，之前听导游说，刚建国前北京城里的王府就有三千多间，为了发展都被毁掉了，现在只存下三百多间，不免感到惋惜！,2016-07-24,机器人十四号,2
11,恭王府,https://travel.qunar.com/p-oi715478-gongwangfu,北京,4.7,,0,主要是导游很热情！谅解也是入木三分，充分展现了北京人的素质！强烈推荐！！！,2018-06-16,飞哥,3
11,恭王府,https://travel.qunar.com/p-oi715478-gongwangfu,北京,4.7,,0,还行，电子换票挺方便。,2015-08-14,ykun3318,3
11,恭王府,https://travel.qunar.com/p-oi715478-gongwangfu,北京,4.7,,0,扫码购票方便实惠，恭王府气势恢宏，风水布局高超。,2017-09-11,去哪儿用户,2
11,恭王府,https://travel.qunar.com/p-oi715478-gongwangfu,北京,4.7,,0,方便快捷，好评！和珅的花园很漂亮,2015-07-27,yfjk2750,1
11,恭王府,https://travel.qunar.com/p-oi715478-gongwangfu,北京,4.7,,0,恭王府环境不错，确实值得一去！！,2015-07-06,why889989,3
11,恭王府,https://travel.qunar.com/p-oi715478-gongwangfu,北京,4.7,不管是跟团游还是自助游一定要听导游讲解（蹭导游），带着文化和历史去旅游，这样才能更加了解景点,0,去恭王府大多数人都是奔着和珅去的。不管是跟团游还是自助游一定要听导游讲解（蹭导游），带着文化和历史去旅游，这样才能更加了解景点。恭王府的福字非常有名，记得摸一摸。游客比较多，建议网上订票，进景区直接刷身份证，不用排队买票。恭王府距离后海不远，可以顺带着逛逛后海。,2016-09-22,十二橡树C,3
11,恭王府,https://travel.qunar.com/p-oi715478-gongwangfu,北京,4.7,客服居然告诉我不能退，还要联系导游，那还真是挺遗憾的，我实在没办法，我自己去恭王府买的票，等我...,0,希望能给看到的人提个醒，第一我没想到去哪网会这么不负责任，定的是13点的，我12点50到的，结果等到13点10分都没见到人，于是我给去哪打电话，去哪说帮我问问，问完之后给了我一个电话让我自己联系，也行，去哪网忙，我自己联系，打电话没人接，这个时候已经快13点半了，我又联系客服，客服说稍等再给我联系，我就想考虑没考虑游客的感受，利用周末来北京玩，时间挺赶的，我要求客服把票退了，客服居然告诉我...,2018-10-14,pfnm1171,2
11,恭王府,https://travel.qunar.com/p-oi715478-gongwangfu,北京,4.7,,0,导游人真的很好，讲解的很明白，服务特别好，整个团非常满意。三分看七分听，故宫的震撼是需要自己感受的,2018-01-28,G郭,2
12,清华大学,https://travel.qunar.com/p-oi715110-qinghuadaxue,北京,4.7,清华大学： 培养未来领袖的摇篮,0,清华大学被誉为培养未来领袖的摇篮，这主要得益于其深厚的教育背景、国际化的教育项目以及对未来领导者素质的全面培养。以下是清华大学在培养未来领袖方面的几个关键点：1. **苏世民书院的全球领导力项目**：清华大学苏世民书院设立了“全球领导力”硕士学位项目，这是全球首个为应对21世纪地缘政治局势而设立的奖学金项目。该项目旨在培养深入了解中国文化和国情，具有国际视野、优秀综合素质和卓越领导能力...,2024-03-20,旅行韵律,3
12,清华大学,https://travel.qunar.com/p-oi715110-qinghuadaxue,北京,4.7,清华大学： 如何成为学术与实践并重的翘楚？,0,清华大学在学术与实践并重方面的表现，使其成为了培养全面发展人才的典范。以下是一些关键因素和措施，帮助清华大学实现这一目标：1. **强化学术研究**：清华大学拥有一流的教授团队和研究设施，为学生提供了深入学术研究的机会。学校鼓励学生参与前沿科研项目，培养他们的研究能力和创新思维。2. **实践教学体系**：清华大学注重理论与实践相结合的教学方式。通过实验室实践、实习机会和项目合作等方式，学...,2024-03-20,旅行韵律,3
12,清华大学,https://travel.qunar.com/p-oi715110-qinghuadaxue,北京,4.7,走进清华：体验中国最顶尖学府的独特魅力,0,走进清华大学，首先会被其深厚的历史底蕴和现代学术氛围所吸引。作为中国顶尖的学府之一，清华大学不仅在学术研究领域享有盛誉，其校园文化、建筑风格和教育理念也构成了它独特的魅力。以下是一些体验清华大学魅力的方面：1. **历史与现代的融合**：清华大学的校园既有古典的建筑风格，如清华园的老建筑，又有现代的教学大楼和实验室。这种历史与现代的结合体现了学校的传承与发展。2. **国际化视野**：清华...,2024-03-20,旅行韵律,3
12,清华大学,https://travel.qunar.com/p-oi715110-qinghuadaxue,北京,4.7,从清华走向创业：这些校友的成功秘诀是什么？,0,清华大学的校友在创业领域取得了显著的成功，这些成功背后有一些共同的秘诀：1. **扎实的技术基础**：作为国内顶尖的学府，清华大学提供了坚实的技术教育和实践机会，使得校友们在各自的专业领域拥有深厚的技术背景和创新能力。2. **全面的素质教育**：除了专业技术之外，清华的教育还注重培养学生的综合素质，包括领导力、沟通能力和团队协作能力，这些都是创业成功的重要因素。3. **积极的风险意识**：清...,2024-03-20,旅行韵律,3
12,清华大学,https://travel.qunar.com/p-oi715110-qinghuadaxue,北京,4.7,...“西方绘画500年”的，这个展从门票开始就充满了心意和收藏价值，虽然是漫长的排队时间也变得兴奋,5,今天来写清华大学！对于不是这个学校的学生近这个学校其实挺容易的，我是为了来看清华大学美术馆来的，结果以为进清华还要预约，就从另一个门网上预约后排队进去的。其实如果你是要去清华大学美术馆的话根本不用这么麻烦就可以进去，直接在地图上搜“清华大学美术馆”15号线跟着导航就进来了，参观完美术馆之后还可以参观学校，没有那么麻烦的。当然我是来看“西方绘画500年”的，这个展从门票开始就充满了心...,2019-01-24,第15人格,3
12,清华大学,https://travel.qunar.com/p-oi715110-qinghuadaxue,北京,4.7,清华大学：不只是学术殿堂，更是创新与梦想的摇篮,0,清华大学不仅在学术领域有着深厚的积累，而且在**创新和梦想的培养上同样表现突出**。以下是清华大学在这些方面的一些亮点：1. **国家级创新创业教育实践基地**：清华大学被选为首批国家级创新创业教育实践基地之一，这表明了其在创新创业教育领域的领先地位。2. **鼓励学生追梦**：清华大学不仅教导学生要有梦想，还鼓励他们坚持个人梦想，并帮助他们获得实现梦想的能力。3. **清华科技园**：位于清华大学...,2024-03-20,旅行韵律,3
12,清华大学,https://travel.qunar.com/p-oi715110-qinghuadaxue,北京,4.7,清华大学是北京的必游景点之一，水木清华，清华大学堂，清华园又是清华大学的三个著名景点,3,清华大学是北京的必游景点之一，水木清华，清华大学堂，清华园又是清华大学的三个著名景点。建议游玩2小时，体验一下中国最高学府的底蕴,2016-09-16,去哪儿用户,3
12,清华大学,https://travel.qunar.com/p-oi715110-qinghuadaxue,北京,4.7,所以清华大学实际上是以前的皇家园林，你说能不好看么？但是那里确实查验最严的地方，很不好进，尤其是北大,5,如果每个人都有一个大学梦，那也许每个人曾经都会有过一个清华北大梦了。对于某些理工科的娃娃来说，也许清华的名头要大一点，作为我国最优秀的学府之一，来清华上学是多少学子的梦想呀，这里自然也成为了参观的地方。其实清华园原来是圆明园的一部分，后来分离改名为清华园的！所以清华大学实际上是以前的皇家园林，你说能不好看么？清华大学作为一个学府，本身还是不收取门票的，但是来清华参观的人实在是...,2015-11-21,QD大白,3
12,清华大学,https://travel.qunar.com/p-oi715110-qinghuadaxue,北京,4.7,沿着那些人排队的方向（不知道东南西北，应该是北边）走，直走一两百米，右手侧应该能看见清华大学那...,5,水木清华。【进校】清华大学也要刷身份证，最有名的不过清华正门，其实有一种方法可以免排队进入，特别是碰到不能进的时候这个方法可以进校！如下：不要听信把你开车送进去的，其实出租车就能开进去，特别是你从酒店直接打的过来让他开进去就是了，根本不用交100给门口黑车司机，他也就是这样开进去，我们就这样浪费了100，虽然进去了，不过出租车同样能进去不用查证件，因为清华大学超级大，里面有超市小卖部...,2015-08-07,chienboo,3
12,清华大学,https://travel.qunar.com/p-oi715110-qinghuadaxue,北京,4.7,东门进西门出或者西门进东门出是个不错的选择，“著名景点”如主楼，二校门，清华学堂，图书馆，水木...,5,不明白为啥要放个价格在这里，T大是不收门票的，但是进校门的时候有可能会被保安拦住要求出示学生证。T大有东门、西门、南门、北门、东北门、西南门等几个门，游客进入比较多的应该是东门和西门。对了，说一句，东门朝南开，是的你没看错……朝东开的门我们叫它东北门……逛园子的话，东门进西门出或者西门进东门出是个不错的选择，“著名景点”如主楼，二校门，清华学堂，图书馆，水木清华，荷塘月色等，...,2015-12-08,Z三公子,3
12,清华大学,https://travel.qunar.com/p-oi715110-qinghuadaxue,北京,4.7,与北京大学仅一路之隔，所以可以将两所大学放在同一天参观。清华大学是中国的著名大学之一,4,清华大学是中国的著名大学之一。与北京大学仅一路之隔，所以可以将两所大学放在同一天参观。由于位于市区，所以去的交通还是十分便利的，可以在市内乘坐307路、594路、731路、运通110线等多趟公交车前往，到清华园站下车可至。由于清华大学的主要景观，如近春园、水木清华、大礼堂、清华学堂、二校门等都位于西门附近， 所以一般随团游，都会选择从此门进入。只需凭身份证登记就可以免费入内了，参观的时候，...,2015-02-03,拉美西斯三世,3
12,清华大学,https://travel.qunar.com/p-oi715110-qinghuadaxue,北京,4.7,水质不是很好），熙春园（里面好多古建筑，清华园在里面），观畴园（他们自己人叫万人餐厅，没有卡只...,5,梦寐以求的地方，从西门进的，南门出的，个人觉得如果不急就别租自行车了，有好多地方有了自行车就去不了了，不要相信商贩门说的八千多亩地走不过来，值得看的也就清华以前的建筑，我和对象是5.1去的，门口有好多大学生志愿者带你去溜达。路线：近春园遗址（传说中的荷塘月色就在这，五一的荷花还真开了，水质不是很好），熙春园（里面好多古建筑，清华园在里面），观畴园（他们自己人叫万人餐厅，没有卡只能...,2014-05-02,野马_狂奔,3
12,清华大学,https://travel.qunar.com/p-oi715110-qinghuadaxue,北京,4.7,清华的西门可以进去参观，一般冬季人比较少。清华园，曾几何时多少学子梦寐以求的求学场所,5,水木清华，四个字把清华最顶尖的两个专业给说清楚了。清华大学，被公认为是理工人才的摇篮。上个世纪初叶，清华大学因庚子赔款而兴建，是清朝派出公费留学的预备机构。许多人都和清华结下了不解之缘。清华大学，清高华贵，有着贵族气质。朱自清在这里写下了荷塘月色。许多名人来这里演讲，像2005年神舟文化之旅的李敖，就在这里开坛讲学。清华园，曾几何时多少学子梦寐以求的求学场所。进了清华校门，许多人就...,2014-04-17,王卫科,3
12,清华大学,https://travel.qunar.com/p-oi715110-qinghuadaxue,北京,4.7,...三陵一日游很开心，导游曹丽燕，名胜古迹讲解非常专业，细节把握非常周到，下次来北京玩还找曹导😁,0,今天的八达岭长城十三陵一日游很开心，导游曹丽燕，名胜古迹讲解非常专业，细节把握非常周到，下次来北京玩还找曹导😁,2020-12-27,smgm8386,1
12,清华大学,https://travel.qunar.com/p-oi715110-qinghuadaxue,北京,4.7,,0,美女导游非常热情，讲解非常到位，给每位游客照顾周到，非常感谢！！！,2020-12-16,qunar用户,3
12,清华大学,https://travel.qunar.com/p-oi715110-qinghuadaxue,北京,4.7,太棒了，很开心的一次旅行，接待服务很好，介绍周围名胜古迹，讲解的很透彻，一家人都很开心,0,太棒了，很开心的一次旅行，接待服务很好，介绍周围名胜古迹，讲解的很透彻，一家人都很开心。颐和园很美，第一次来玩的很好，谢谢导游的,2020-11-26,ebzy9120,3
12,清华大学,https://travel.qunar.com/p-oi715110-qinghuadaxue,北京,4.7,,0,非常满意田导一天的服务和讲解，学到了很多东西，很棒👍🏻,2020-10-24,pfkg0455,1
12,清华大学,https://travel.qunar.com/p-oi715110-qinghuadaxue,北京,4.7,,0,给细心耐心热心真心的付导点个赞，五星好评！,2020-12-13,gyve2481,3
12,清华大学,https://travel.qunar.com/p-oi715110-qinghuadaxue,北京,4.7,是一次很喜欢的游程，很感谢张导的细心照顾，我很开心的一次旅行,0,第一次来北京，很久以前就对北京有无限憧憬，是最想来的地方，这次和遨游公司有缘，跟着张导旅游了八达岭长城，颐和园，鸟巢水立方，还看到了清华北大。是一次很喜欢的游程，很感谢张导的细心照顾，我很开心的一次旅行。,2020-12-12,pkrk3585,3
12,清华大学,https://travel.qunar.com/p-oi715110-qinghuadaxue,北京,4.7,,0,夏导很专业 讲解非常好 先去了长城 后去了颐和园。有了夏导的讲解。很多历史再现,2020-11-03,jingxingxing,3
12,清华大学,https://travel.qunar.com/p-oi715110-qinghuadaxue,北京,4.7,早上七点半按照美女曹导的安排，在建德门等，车子很准时，曹导是个可爱的80后，为人很好,0,早上七点半按照美女曹导的安排，在建德门等，车子很准时，曹导是个可爱的80后，为人很好。玩了定陵然后吃饭，下午玩长城，长城人还是很多的，没办法，著名景点，回程在鸟巢下车，玩了下鸟巢然后回去，全程安排很妥善，中途无购物项目，曹导介绍很详细，比起自己玩有意义多了！,2020-11-20,胡zxdh6082,1
12,清华大学,https://travel.qunar.com/p-oi715110-qinghuadaxue,北京,4.7,,0,赶到十一黄金周 可惜人太多了 不过还是要谢谢导游朱军的耐心讲解 态度很好 给他个👍,2017-10-03,tcdk3819,1
12,清华大学,https://travel.qunar.com/p-oi715110-qinghuadaxue,北京,4.7,非常不错的行程，全程没有购物，华导游风趣幽默，司机史师傅稳健，车厢干净整洁，把北京历史风情介绍...,0,非常不错的行程，全程没有购物，华导游风趣幽默，司机史师傅稳健，车厢干净整洁，把北京历史风情介绍得头头是道，很涨知识，行程的最后，还给大家介绍北京的美食，非常贴心,2020-11-08,nrbu2957,3
12,清华大学,https://travel.qunar.com/p-oi715110-qinghuadaxue,北京,4.7,,0,此次旅行非常愉快，导游也非常的专业。整个旅行安排的很好，给杨导点赞，下次旅行，继续选择这里。,2020-10-07,eonp3404,3
12,清华大学,https://travel.qunar.com/p-oi715110-qinghuadaxue,北京,4.7,一天的行程，小夏导游讲解特别专业，服务很热情，妈妈说，看景不如听景，通过导游讲解，我们的行程很顺利,0,一天的行程，小夏导游讲解特别专业，服务很热情，妈妈说，看景不如听景，通过导游讲解，我们的行程很顺利。感谢小夏导游，感谢司机王师傅,2021-03-09,北京有什么好玩的,2
12,清华大学,https://travel.qunar.com/p-oi715110-qinghuadaxue,北京,4.7,,0,叶导游全程非常耐心和友善，景点讲解的也很好，虽然票不是很便宜，但是还是非常值得来一趟滴～,2020-10-29,去哪儿用户,3
12,清华大学,https://travel.qunar.com/p-oi715110-qinghuadaxue,北京,4.7,非常不错的行程，全程没有购物，导游张文颖风趣幽默，把北京历史风情介绍得头头是道，很涨知识，行程的最后,0,非常不错的行程，全程没有购物，导游张文颖风趣幽默，把北京历史风情介绍得头头是道，很涨知识，行程的最后，还给大家介绍北京的美食，非常贴心,2020-11-05,我是句号,3
12,清华大学,https://travel.qunar.com/p-oi715110-qinghuadaxue,北京,4.7,,0,导游梦姐很敬业，讲解详细，听得很入迷，一天下来很耐心，细心，,2021-03-20,去哪儿用户,3
