attraction_rank,attraction_name,attraction_url,attraction_city,attraction_rating,comment_title,comment_rating,comment_content,comment_date,comment_user,comment_image_count
43,御花园,https://travel.qunar.com/p-oi10066270-yuhuayuan,北京,4.8,...的来了之后发现其实还行，而且真心好看，御花园里的亭子是我最喜欢的形状，个个都像小天坛，非常养眼,5,一直听说故宫的御花园很小，但真的来了之后发现其实还行，而且真心好看，御花园里的亭子是我最喜欢的形状，个个都像小天坛，非常养眼。,2020-06-13,,0
43,御花园,https://travel.qunar.com/p-oi10066270-yuhuayuan,北京,4.8,故宫御花园、慈宁花园植有大量名品牡丹 暮春时节，牡丹盛开，满园春色 雍容华贵，端庄优雅，仪态万...,5,故宫御花园、慈宁花园植有大量名品牡丹  暮春时节，牡丹盛开，满园春色  雍容华贵，端庄优雅，仪态万千，姹紫嫣红  与雕梁画栋的皇家宫殿气质相衬  仿佛又见旧时宫銮之中的繁华之景,2020-04-27,,0
43,御花园,https://travel.qunar.com/p-oi10066270-yuhuayuan,北京,4.8,...一枝春带雨 带雨梨花，一年一年 望尽多少宫闱女子满衫泪 来故宫，御花园一定认真，仔细的好好看看,5,清明时节雨纷纷  梨花一枝春带雨  带雨梨花，一年一年  望尽多少宫闱女子满衫泪 来故宫，御花园一定认真，仔细的好好看看。,2020-04-11,,0
43,御花园,https://travel.qunar.com/p-oi10066270-yuhuayuan,北京,4.8,,5,御花园不大，但也是打卡之地，故宫所有景点都值得去N次。,2020-01-15,,0
43,御花园,https://travel.qunar.com/p-oi10066270-yuhuayuan,北京,4.8,御花园这里景色还是特别漂亮的啊，这里是故宫的后花园了，来这里玩的人非常的多在这里有很多千年的老树了啊,5,御花园这里景色还是特别漂亮的啊，这里是故宫的后花园了，来这里玩的人非常的多在这里有很多千年的老树了啊，都是这里的无价之宝呢。,2019-12-18,,0
43,御花园,https://travel.qunar.com/p-oi10066270-yuhuayuan,北京,4.8,,5,御花园里有很多古老的柏树与槐树，这里的连理柏也是故宫中的奇树之一，树皮很奇特，异常高大。,2019-06-13,,0
43,御花园,https://travel.qunar.com/p-oi10066270-yuhuayuan,北京,4.8,,5,御花园位于北京紫禁城中轴线上，坤宁宫后方，明代称为宫后苑，清代称御花园，是汉族园林建筑之精华。,2019-04-22,,0
43,御花园,https://travel.qunar.com/p-oi10066270-yuhuayuan,北京,4.8,,5,看下电视中的御花园是什么景色。。,2018-04-15,,0
43,御花园,https://travel.qunar.com/p-oi10066270-yuhuayuan,北京,4.8,,5,园内的松，柏，竹子与山石，形成了四季常青的园林景观。,2018-04-10,,0
43,御花园,https://travel.qunar.com/p-oi10066270-yuhuayuan,北京,4.8,,4,因为人实在是多 每次来这都是走马观花的 看看,2018-04-10,,0
43,御花园,https://travel.qunar.com/p-oi10066270-yuhuayuan,北京,4.8,,5,好地方，不过要结合解说看起来才有意思,2018-03-30,,0
43,御花园,https://travel.qunar.com/p-oi10066270-yuhuayuan,北京,4.8,,4,御花园内景色别致，让人流连忘返。,2018-03-12,,0
43,御花园,https://travel.qunar.com/p-oi10066270-yuhuayuan,北京,4.8,,4,很值得去的，假山不错周围很多古树,2018-02-11,,0
43,御花园,https://travel.qunar.com/p-oi10066270-yuhuayuan,北京,4.8,,5,不错呢，历史悠久，环境优雅，高大上，可以可以,2018-02-03,,0
43,御花园,https://travel.qunar.com/p-oi10066270-yuhuayuan,北京,4.8,,4,还有人没去过这吗，这里的文化底蕴非常好,2018-02-02,,0
43,御花园,https://travel.qunar.com/p-oi10066270-yuhuayuan,北京,4.8,,4,地方很小，难为了以前的妃嫔了，估计不到半个时辰就可以走四五遍了,2018-02-01,,0
43,御花园,https://travel.qunar.com/p-oi10066270-yuhuayuan,北京,4.8,,4,风景不错，典雅高贵，空气清新凉爽。,2018-01-31,,0
43,御花园,https://travel.qunar.com/p-oi10066270-yuhuayuan,北京,4.8,整个御花园里景观点挺多的，可能皇帝老人家想要移步换景的效果吧，不过个人感觉有些堆砌了，没有主次...,5,整个御花园里景观点挺多的，可能皇帝老人家想要移步换景的效果吧，不过个人感觉有些堆砌了，没有主次的层次感，且人工痕迹很重。,2018-01-29,,0
43,御花园,https://travel.qunar.com/p-oi10066270-yuhuayuan,北京,4.8,,5,北京，北京故宫是，去北京必游的景点之一。这里，恢弘大气，建筑古老，非常值得去看一下。,2018-01-25,,0
43,御花园,https://travel.qunar.com/p-oi10066270-yuhuayuan,北京,4.8,,5,御花园，景色不错~春天很好看。,2018-01-22,,0
43,御花园,https://travel.qunar.com/p-oi10066270-yuhuayuan,北京,4.8,,5,御花园以钦安殿为中心，园林建筑采用主次相辅、左右对称的格局，布局紧凑、古典富丽。,2018-01-20,,0
43,御花园,https://travel.qunar.com/p-oi10066270-yuhuayuan,北京,4.8,,5,很精致的园林，亭子里都是很棒的书法作品，皇家气息浓重,2018-01-19,,0
43,御花园,https://travel.qunar.com/p-oi10066270-yuhuayuan,北京,4.8,,4,很漂亮。尽管是冬天，还是能体会到郁郁葱葱的感觉,2018-01-12,,0
43,御花园,https://travel.qunar.com/p-oi10066270-yuhuayuan,北京,4.8,,5,那里边的由无数精美的大湖石堆砌而成的假山及亭榭巨大壮观。,2018-01-07,,0
43,御花园,https://travel.qunar.com/p-oi10066270-yuhuayuan,北京,4.8,,5,春天来看看，可以看看各种各样的花儿,2018-01-04,,0
43,御花园,https://travel.qunar.com/p-oi10066270-yuhuayuan,北京,4.8,,5,景色优美，放轻心情，空气清新。,2018-01-02,,0
43,御花园,https://travel.qunar.com/p-oi10066270-yuhuayuan,北京,4.8,,5,感觉像是穿越到古代皇宫一样 御花园很美的景色,2017-12-31,,0
43,御花园,https://travel.qunar.com/p-oi10066270-yuhuayuan,北京,4.8,,5,景山公园附近，特别去参观了一圏。,2017-12-30,,0
43,御花园,https://travel.qunar.com/p-oi10066270-yuhuayuan,北京,4.8,,5,皇帝的选址，皇帝的选择，真心不错，身心愉悦,2017-12-27,,0
43,御花园,https://travel.qunar.com/p-oi10066270-yuhuayuan,北京,4.8,,5,总是在影视剧里面看到这个地方。,2017-12-25,,0
43,御花园,https://travel.qunar.com/p-oi10066270-yuhuayuan,北京,4.8,,4,皇家园林，趣味浓郁，值得去看看,2017-12-25,,0
43,御花园,https://travel.qunar.com/p-oi10066270-yuhuayuan,北京,4.8,,5,小桥流水，花草树木假山，园林景观精致秀丽。,2017-12-23,,0
43,御花园,https://travel.qunar.com/p-oi10066270-yuhuayuan,北京,4.8,御花园内的亭台楼阁，假山古树众多。游故宫肯定少不了御花园,5,御花园内的亭台楼阁，假山古树众多。游故宫肯定少不了御花园。只是如果想象一下，皇帝后宫的妃子们一辈子只能在御花园游玩，还是民间自由啊。,2017-12-22,,0
43,御花园,https://travel.qunar.com/p-oi10066270-yuhuayuan,北京,4.8,,5,值得一看，名胜古迹，风景优美。,2017-12-22,,0
43,御花园,https://travel.qunar.com/p-oi10066270-yuhuayuan,北京,4.8,,4,冬天的御花园略显凄凉 没有什么特别的景 不知道映像中那么大的御花园哪来的,2017-12-20,,0
43,御花园,https://travel.qunar.com/p-oi10066270-yuhuayuan,北京,4.8,,4,不大，很精致。人多看不出来了，顺着走就看完了。,2017-12-20,,0
43,御花园,https://travel.qunar.com/p-oi10066270-yuhuayuan,北京,4.8,,4,挺不错的，里面有很多珍奇的大树，长得千姿百态。,2017-12-18,,0
43,御花园,https://travel.qunar.com/p-oi10066270-yuhuayuan,北京,4.8,,5,电影里面的场景，好像是。不错哦,2017-12-16,,0
43,御花园,https://travel.qunar.com/p-oi10066270-yuhuayuan,北京,4.8,,4,没有想象的那么漂亮大气！可能是被电视剧误导了,2017-12-15,,0
43,御花园,https://travel.qunar.com/p-oi10066270-yuhuayuan,北京,4.8,,5,在雄伟庞大的故宫建筑群中，晓得格外的娇小玲珑,2017-12-14,,0
43,御花园,https://travel.qunar.com/p-oi10066270-yuhuayuan,北京,4.8,,5,很有江南风格，园林特色，就是小了一点。,2017-12-10,,0
43,御花园,https://travel.qunar.com/p-oi10066270-yuhuayuan,北京,4.8,,5,身临其境的感觉，很不错，就是人有些多,2017-12-09,,0
43,御花园,https://travel.qunar.com/p-oi10066270-yuhuayuan,北京,4.8,御花园位于北京紫禁城中轴线上，坤宁宫后方，明代称为宫后苑，清代称御花园,5,御花园位于北京紫禁城中轴线上，坤宁宫后方，明代称为宫后苑，清代称御花园。始建于明永乐十八年 (1420年)，以后曾有增修，现仍保留初建时的基本格局。,2017-12-09,,0
43,御花园,https://travel.qunar.com/p-oi10066270-yuhuayuan,北京,4.8,,3,这里非常的好啊，装完气派，值得一看的,2017-12-09,,0
43,御花园,https://travel.qunar.com/p-oi10066270-yuhuayuan,北京,4.8,,5,故宫里面的景点，是古代皇室休闲的地方,2017-12-08,,0
43,御花园,https://travel.qunar.com/p-oi10066270-yuhuayuan,北京,4.8,,5,比较精致，独具匠心，赞叹，慢慢欣赏，不要跟团,2017-11-14,,0
43,御花园,https://travel.qunar.com/p-oi10066270-yuhuayuan,北京,4.8,,5,园林典范，来过就会感觉到不虚此行！,2017-11-13,,0
43,御花园,https://travel.qunar.com/p-oi10066270-yuhuayuan,北京,4.8,,5,御花园，电视剧里经常会有的，去看看带入一下也挺好玩的,2017-10-20,,0
43,御花园,https://travel.qunar.com/p-oi10066270-yuhuayuan,北京,4.8,,4,很美，植物很茂盛，空气不错。。。,2017-09-28,,0
44,百里山水画廊,https://travel.qunar.com/p-oi7473474-bailishanshuihualang,北京,4.4,北京最美的秋天来啦，当然要好好利用周末时间近郊一日游！也看到正在修建木栈道，期待修好的时候再来,5,北京最美的秋天来啦，当然要好好利用周末时间近郊一日游！一早九点多出发，沿G6一路开到延庆，一路上都能看到指示牌明确指明“百里山水画廊”的方向，再加上导航，完全不用担心走错路。大约11点半左右，到达画廊的起始点——干沟，这里有整个景区的介绍，地图和一些商贩。三个人吃了点东西，拍拍照就又继续上路啦。所谓百里画廊就是一共有一百里，也就是50公里，当然这都是概数，中间有几个景区，比如乌龙峡谷...,2016-09-26,herrrrr,3
44,百里山水画廊,https://travel.qunar.com/p-oi7473474-bailishanshuihualang,北京,4.4,这里的星空真是美过梵高的大作，我们似乎梦游了仙境,4,“百里画廊”顾名思义，延绵百里的一处山路走廊，在山腰处，需要经过一大段山路。我们是周六下午6点出发的，从天津出发走津京唐到北京，沿着6环至八达岭高速一路北上进延庆，听起来并不远，但是我要说的是北京真的很大，我们足足开了4个小时，才到了预定的农家院，这里必须要说一下，其实景区内有很多农家院，但是环境也都一般，条件也一般，我们这次没有什么准备，所以定了距离景区较远的山脚下的一个条件还...,2016-10-13发表于游记金秋时节漫步百里画廊,recoba_yun,3
44,百里山水画廊,https://travel.qunar.com/p-oi7473474-bailishanshuihualang,北京,4.4,是避暑圣地，景区内有不少景点，需要分别买票，去了圭化木，乌龙峡，滴水壸，有些景点很一般，住宿方...,0,北京延庆打造的名片景点，面积三百七十多平方公里，四季景色如画，是避暑圣地，景区内有不少景点，需要分别买票，去了圭化木，乌龙峡，滴水壸，有些景点很一般，住宿方面差了点，只有农家院，有的没热水，总体自然景色还可以。,2017-03-25,去哪儿用户,2
44,百里山水画廊,https://travel.qunar.com/p-oi7473474-bailishanshuihualang,北京,4.4,非常值得一去的地方，有山有水有花有草有树，虽然有一些景点需要买票，但是我们全程都在免费的路两边...,0,非常值得一去的地方，有山有水有花有草有树，虽然有一些景点需要买票，但是我们全程都在免费的路两边玩耍，特别尽兴。五一从人头攒动的世园会和八达岭出来，来到百里画廊，呼吸着新鲜空气，吹着凉爽的小山风，零零星星的游人们开心地玩着，很爽！,2019-05-28,去哪儿用户,3
44,百里山水画廊,https://travel.qunar.com/p-oi7473474-bailishanshuihualang,北京,4.4,延庆的百里山水画廊是一个自驾游的理想去处，沿着公路行驶，随时可以停下来赏花、嬉水、观景，自然风光迷人,4,延庆的百里山水画廊是一个自驾游的理想去处，沿着公路行驶，随时可以停下来赏花、嬉水、观景，自然风光迷人，几个收费的景点一般般，不如沿途的景色。,2018-10-01,,4
44,百里山水画廊,https://travel.qunar.com/p-oi7473474-bailishanshuihualang,北京,4.4,所以说，出门游玩必须开车，不然都没法痛快滴“玩耍”。好好玩的样子。人家是带着美丽的心情和美景合影,5,由于出门便不是大早，故而到达游客中心时，已到午膳时分。停好车，稍微遛遛，忽然毛毛雨了。老爸说上坡儿上看看，我在用嘴巴答应的同时，满心都在惦记对面儿路边儿老爷子卖的南瓜。拉着老爸赶快过去挑。3个南瓜，12块钱。其中2块钱是老爷子说再多给他2块钱，我们一想老爷子年岁大，怪不容易的，多2块就多2块吧。结果其中一个长南瓜有些绿，给家中坐镇的老妈电话，被告知绿的不甜。额~~~~~临走时过去跟老爷子商...,2016-10-18发表于游记【我与JIA人有约】薄纱下的彩色水墨画,娜黛,3
44,百里山水画廊,https://travel.qunar.com/p-oi7473474-bailishanshuihualang,北京,4.4,,5,沿着山路，看风景，山水风光无限,2020-08-22,,0
44,百里山水画廊,https://travel.qunar.com/p-oi7473474-bailishanshuihualang,北京,4.4,百里画廊的有很多凉快的林子，还有溪水潺潺，适合一家人周末休闲,5,百里画廊的有很多凉快的林子，还有溪水潺潺，适合一家人周末休闲。附近采摘园的杏子熟了，又棉又软口感非常好。,2020-06-21,,7
44,百里山水画廊,https://travel.qunar.com/p-oi7473474-bailishanshuihualang,北京,4.4,延庆，联合国教科文组织世界地质公园～硅化木景区，是百里画廊的重要组成部分。什么是硅化木,5,延庆，联合国教科文组织世界地质公园～硅化木景区，是百里画廊的重要组成部分。什么是硅化木？硅化木是木化石的一种，据科学家考证，当地木化石产生于中侏罗纪晚期，距今已经历一亿三千万年的沧桑岁月。那时当地是莽莽林海，植被茂盛，到处生长着以宽孔异木（现称古松柏类树木）为主的原始森林，后来由于地壳发生剧烈变化，骤然沉积硅化而形成古木化石，地壳再度变化将古木化石浮于地面。,2020-05-30,,3
44,百里山水画廊,https://travel.qunar.com/p-oi7473474-bailishanshuihualang,北京,4.4,延庆百里山水画廊距北京市区约110公里，包含一环三区十二个空间节点，沿途风景优美，赏心悦目，有...,3,延庆百里山水画廊距北京市区约110公里，包含一环三区十二个空间节点，沿途风景优美，赏心悦目，有燕山天池，硅化木、乌龙峡谷，滴水壶、龙王庙、关帝庙等多处景点。,2020-05-22,,3
44,百里山水画廊,https://travel.qunar.com/p-oi7473474-bailishanshuihualang,北京,4.4,除了常规出名的几家公园以外，进入百里山水画廊沿途也有很多观景台，景色也都很好哒,5,除了常规出名的几家公园以外，进入百里山水画廊沿途也有很多观景台，景色也都很好哒。春天赏花，夏天避暑，秋天赏叶，冬天赏雪。,2020-04-20,,3
44,百里山水画廊,https://travel.qunar.com/p-oi7473474-bailishanshuihualang,北京,4.4,...沿途都是美景，可以说一步一景，有着最美最长的路程，景区内山水如画，连接构成一幅五彩斑澜的油彩画,5,北京延庆区的百里画廊又称百里山水画廊，这里沿途都是美景，可以说一步一景，有着最美最长的路程，景区内山水如画，连接构成一幅五彩斑澜的油彩画。,2019-11-19,,8
44,百里山水画廊,https://travel.qunar.com/p-oi7473474-bailishanshuihualang,北京,4.4,百里山水画廊 北京延庆&quot;滦赤、花千、花沙公路穿镇而过自成环线，交通便利，景色秀美,5,"百里山水画廊 北京延庆""百里山水画廊""位于延庆县东北部千家店镇，属延庆生态涵养发展区的核心区，总面积371平方公里，距延庆县城40公里，距北京市区110公里。东与怀柔区毗邻，北与河北省赤城县接壤，西南、东南分别于香营、刘斌堡、珍珠泉三个乡相连。滦赤、花千、花沙公路穿镇而过自成环线，交通便利，景色秀美。",2019-11-19,,8
44,百里山水画廊,https://travel.qunar.com/p-oi7473474-bailishanshuihualang,北京,4.4,...庆到怀柔的一条美丽的山沟，一条小河缓缓流淌，其中有无数的小湖，山景倒映在湖中，真是一片大好风光,5,百里画廊是一条横贯北京北部，从延庆到怀柔的一条美丽的山沟，一条小河缓缓流淌，其中有无数的小湖，山景倒映在湖中，真是一片大好风光。,2019-11-11,,8
44,百里山水画廊,https://travel.qunar.com/p-oi7473474-bailishanshuihualang,北京,4.4,百里山水画廊的山层峦叠嶂，能看见好几重山，浓淡远近，有传统国画的，而秋季到来这里五彩斑斓，绚丽...,5,百里山水画廊的山层峦叠嶂，能看见好几重山，浓淡远近，有传统国画的，而秋季到来这里五彩斑斓，绚丽多彩，又有着传统西洋油画的美感。,2019-11-08,,8
44,百里山水画廊,https://travel.qunar.com/p-oi7473474-bailishanshuihualang,北京,4.4,百里山水画廊是北京地区最著名的景点之一，这里山青水秀，树木茂密，更有山间小瀑布，给景点增色不少,5,百里山水画廊是北京地区最著名的景点之一，这里山青水秀，树木茂密，更有山间小瀑布，给景点增色不少。深秋到了，漫山红叶变得更加鲜艳。,2019-11-05,,8
44,百里山水画廊,https://travel.qunar.com/p-oi7473474-bailishanshuihualang,北京,4.4,这里的水面平静如镜，彩叶倒影在水中，美极了,5,进入十月下旬以来，随着天气逐渐转冷，百里山水画廊的森林开始变得五彩缤纷，绚丽多彩。这里的水面平静如镜，彩叶倒影在水中，美极了。,2019-11-02,,8
44,百里山水画廊,https://travel.qunar.com/p-oi7473474-bailishanshuihualang,北京,4.4,百里山水画廊位于北京北部山区，秋天到来百里画廊一年中最美的季节来了,5,百里山水画廊位于北京北部山区，秋天到来百里画廊一年中最美的季节来了。树木变成五彩缤纷的彩叶林，芦苇黄了，金黄里透着红色，美极了。,2019-11-01,,8
44,百里山水画廊,https://travel.qunar.com/p-oi7473474-bailishanshuihualang,北京,4.4,...要大半天的时间，其实秋色最美的也是在路上，走走停停欣赏一下山里的景色和呼吸下新鲜的空气非常不错,4,在不进任何中途景区的情况下整体开下来需要大半天的时间，其实秋色最美的也是在路上，走走停停欣赏一下山里的景色和呼吸下新鲜的空气非常不错,2019-10-30,,3
44,百里山水画廊,https://travel.qunar.com/p-oi7473474-bailishanshuihualang,北京,4.4,...山水画廊绝对是首选，有山有水有树林，孩子已经按耐不住了，必须下车玩会儿，水很清，周围景色非常棒,5,周末临时起意决定带孩子去山里走走，百里山水画廊绝对是首选，有山有水有树林，孩子已经按耐不住了，必须下车玩会儿，水很清，周围景色非常棒！过完十一去景色应该会更棒！秋意更浓！,2019-09-23,,4
44,百里山水画廊,https://travel.qunar.com/p-oi7473474-bailishanshuihualang,北京,4.4,景色秀丽，环境幽静，远离城市，连空气都感觉是那么的新鲜,0,百里山水画廊，果然名不虚传，景如其名，山山水水，走到哪里都是一幅幅美图。景色秀丽，环境幽静，远离城市，连空气都感觉是那么的新鲜。,2019-07-07,,3
44,百里山水画廊,https://travel.qunar.com/p-oi7473474-bailishanshuihualang,北京,4.4,景色秀丽，环境幽静，远离城市，连空气都感觉是那么的新鲜,5,百里山水画廊，果然名不虚传，景如其名，山山水水，走到哪里都是一幅幅美图。景色秀丽，环境幽静，远离城市，连空气都感觉是那么的新鲜。,2019-07-07,,3
44,百里山水画廊,https://travel.qunar.com/p-oi7473474-bailishanshuihualang,北京,4.4,非常值得一去的地方，有山有水有花有草有树，虽然有一些景点需要买票，但是我们全程都在免费的路两边...,5,非常值得一去的地方，有山有水有花有草有树，虽然有一些景点需要买票，但是我们全程都在免费的路两边玩耍，特别尽兴。五一从人头攒动的世园会和八达岭出来，来到百里画廊，呼吸着新鲜空气，吹着凉爽的小山风，零零星星的游人们开心地玩着，很爽！,2019-05-28,,3
44,百里山水画廊,https://travel.qunar.com/p-oi7473474-bailishanshuihualang,北京,4.4,仃车随意，特别适合带老人和孩子，可凭心情随意美拍，随手一拍的免费屏保，夕阳夕下流连忘返，等到秋天再来,5,五一到百里山水画廊，一步一景，收费少，仃车随意，特别适合带老人和孩子，可凭心情随意美拍，随手一拍的免费屏保，夕阳夕下流连忘返，等到秋天再来,2019-05-03,,8
44,百里山水画廊,https://travel.qunar.com/p-oi7473474-bailishanshuihualang,北京,4.4,这两天由于北方冷空气到来，延庆县下起了中雪，树和鲜花上落满雪花，美极了,5,百里山水画廊是延庆县一条绿色通道，这里植被茂盛，并长满鲜花，每到春天鲜花盛开。这两天由于北方冷空气到来，延庆县下起了中雪，树和鲜花上落满雪花，美极了。,2019-04-10,,8
44,百里山水画廊,https://travel.qunar.com/p-oi7473474-bailishanshuihualang,北京,4.4,...显紧张，沿途的什么乌龙峡谷、硅化木公园等收费景点没必要进去了，免费的行程都看不过来，而且足够美,5,贯穿延庆和怀柔的山水画廊简直太美了，四季有不同的景观，值得在不同时节都去看看。一天自驾时间稍显紧张，沿途的什么乌龙峡谷、硅化木公园等收费景点没必要进去了，免费的行程都看不过来，而且足够美。,2018-11-07,,8
44,百里山水画廊,https://travel.qunar.com/p-oi7473474-bailishanshuihualang,北京,4.4,,5,延庆百里画廊白河沿线乐趣多多！,2018-11-03,,8
44,百里山水画廊,https://travel.qunar.com/p-oi7473474-bailishanshuihualang,北京,4.4,,0,延庆百里画廊白河沿线乐趣多多！,2018-11-03,,3
44,百里山水画廊,https://travel.qunar.com/p-oi7473474-bailishanshuihualang,北京,4.4,...，龙湾湖畔的晨景更是奇妙和神奇，还有湖中的野鸭、路边的花海，行驶在这里，处处是美景，宛如在画中,0,百里山水画廊，是北京周边最美的自驾线路，也是骑行爱好者的首选线路。十月时节，这里已是山峦叠翠、层林尽染，作为国家地质公园，这里的硅化木景区、乌龙峡谷景区、滴水壶景区既有知识性又有观赏性，龙湾湖畔的晨景更是奇妙和神奇，还有湖中的野鸭、路边的花海，行驶在这里，处处是美景，宛如在画中。,2018-10-26,,3
44,百里山水画廊,https://travel.qunar.com/p-oi7473474-bailishanshuihualang,北京,4.4,...，龙湾湖畔的晨景更是奇妙和神奇，还有湖中的野鸭、路边的花海，行驶在这里，处处是美景，宛如在画中,5,百里山水画廊，是北京周边最美的自驾线路，也是骑行爱好者的首选线路。十月时节，这里已是山峦叠翠、层林尽染，作为国家地质公园，这里的硅化木景区、乌龙峡谷景区、滴水壶景区既有知识性又有观赏性，龙湾湖畔的晨景更是奇妙和神奇，还有湖中的野鸭、路边的花海，行驶在这里，处处是美景，宛如在画中。,2018-10-26,,3
44,百里山水画廊,https://travel.qunar.com/p-oi7473474-bailishanshuihualang,北京,4.4,... 尽是山路 一路标识很少 村民们还好 问了多次 高德地图不给力 景点只有两公里可玩 再也不去了,0,跑了一百五十多公里 尽是山路 一路标识很少 村民们还好 问了多次 高德地图不给力 景点只有两公里可玩 再也不去了,2018-09-20,去哪儿用户,3
44,百里山水画廊,https://travel.qunar.com/p-oi7473474-bailishanshuihualang,北京,4.4,"来一次亲密接触
还记得我们小时候用树叶玩的那个游戏叫什么名字吗？图片来自网络。图片来自网络",5,去赏秋，和色彩鲜艳的树叶来一次亲密接触还记得我们小时候用树叶玩的那个游戏叫什么名字吗？图片来自去哪儿用户@recoba_yun图片来自网络图片来自去哪儿聪明旅行家@娜黛图片来自网络图片来自网络图片来自去哪儿用户@mmmdouer图片来自网络,2018-09-13发表于游记【清爽周末】北京8大自助秋游胜地，首先是舒心，关键是便宜！,传奇贝贝哥,3
