attraction_rank,attraction_name,attraction_url,attraction_city,attraction_rating,comment_title,comment_rating,comment_content,comment_date,comment_user,comment_image_count
1,故宫博物院,https://travel.qunar.com/p-oi710603-gugongbowuyuan,北京,4.8,观展笔记4⃣️6⃣️｜故宫午门新展寻茶记,0,观展笔记4⃣️6⃣️｜故宫午门新展寻茶记李嵩《骷髅幻戏图》，是我知道有这幅画后，就一直想看看真迹的一件，太与众不同的画风。午门的“茶·世界——茶文化特展”，喜欢茶的朋友一定要来看看。以实物梳理一遍古今茶史。1⃣️南宋 李嵩绘 骷髅幻戏图。2⃣️唐 法门寺的茶具系列，这是茶史中不可或缺的部分，精美雅致大方。3⃣️日本 银鸢尾花纹茶具套装。第三展厅讲的就是茶与世界的故事。4⃣️北宋 铜渣...,2024-01-01,跟我去旅行,3
1,故宫博物院,https://travel.qunar.com/p-oi710603-gugongbowuyuan,北京,4.8,28岁之前，你必须拥有的九场旅行,0,28岁之前，你必须拥有的九场旅行,2020-12-25,,0
1,故宫博物院,https://travel.qunar.com/p-oi710603-gugongbowuyuan,北京,4.8,故宫又名紫禁城，世界上现存规模最大的宫殿建筑群，到北京必去的景点，没有之一,5,故宫又名紫禁城，世界上现存规模最大的宫殿建筑群，到北京必去的景点，没有之一。当时冬季下着雪去的，故宫黄色琉璃瓦配上红色的墙体在白雪皑皑下十分亮眼，俨然给人一种很庄严，磅礴的感觉。故宫开放的时间是早上8：30，强烈建议早点到达，争取赶在第一批游客进入，因为太迟的话只能去看人山人海了。门票淡季是40元，旺季是60元，建议网上订票，排队很麻烦。故宫里有地图，可以走中轴线一条直接走到底（金水...,2015-09-02,梵朴,3
1,故宫博物院,https://travel.qunar.com/p-oi710603-gugongbowuyuan,北京,4.8,故宫很大，是明清两代的皇宫，建筑宏伟,5,【说在前面的话】由于晚上已经提前来踩过点了，所以白天的时候就直接过来了，很方便，由于住的地方就是在这附近，乘坐地铁1号线到天安门西站这边下的，然后步行大约20分钟到的天安门广场，盛夏的北京天气很好，没有雾霾，穿过人群来到广场前，走到故宫里面。【关于故宫】故宫是来北京旅游必到的一个景点，北京的历史文化非常深厚，来故宫就可以感受的到，故宫很大，建筑很宏伟，故宫也是明清两代的皇宫，所以...,2016-07-01,凤凰花开的路口但看岁…,3
1,故宫博物院,https://travel.qunar.com/p-oi710603-gugongbowuyuan,北京,4.8,...里，那些生活在其中的帝王妃子们也许不会想到，几百年后，他们曾经居住的场所会让无数的游人趋之若鹜,5,从午门开始沿着南北中轴线一直到神武门，中轴线两侧的宫殿庭院围成一座紫禁城，琉璃瓦在阳光的照射下熠熠闪光，绮丽的角楼耸立在高高的城墙之上，墙外环绕着静静流淌的护城河。五百年了，它以不变的姿态伫立在这里，那些生活在其中的帝王妃子们也许不会想到，几百年后，他们曾经居住的场所会让无数的游人趋之若鹜。清晨的午门早已聚集了许多等待参观故宫的人们，不知道当年皇帝在立春赐春饼的时候，下面百姓...,2014-04-18,村菇奈酱,3
1,故宫博物院,https://travel.qunar.com/p-oi710603-gugongbowuyuan,北京,4.8,...，东线主要是乾隆太上皇时期修建的宁寿宫和珍宝馆、钟表管，时间有限的话可以选自己感兴趣的部分游览,5,【历史】故宫始建于明永乐也即朱棣时期，与元大都位置并不完全相同，落成于1420年，但当年即遭火灾，太和殿焚毁。其实紫禁城还是蛮坎坷的，多次遭受火灾，现存大部分建筑都是在清代重新修建的。【建筑】紫禁城实在是中国建筑的瑰宝，座落在北京城的中轴线上。以北为子，以南为午，从午门进入，经过金水桥和太和门，自南向北排列着太和殿、中和殿、保和殿、乾清宫、交泰殿、坤宁宫、御花园、神武门。其中太和...,2016-06-14,言肆,3
1,故宫博物院,https://travel.qunar.com/p-oi710603-gugongbowuyuan,北京,4.8,太和殿，看到太和殿的时候觉得非常震撼，真的很大，而且很宏伟。这注定是一个充满斗争的地方,5,故宫博物馆交通很方便，有地铁直达，还有多班公车直达，北京的交通费用很便宜。故宫作为明清皇朝的皇城，怎能不去逛一逛呢。几百年前，明清总共有24个皇帝，就是住在这里，一切显得神秘而庄严。这次来北京，长城和故宫是必游之地，我本身是一个很喜欢中国历史的人，而故宫这种活化石可以给我很多关于明清时代的历史。,2016-05-09,三冉1,3
1,故宫博物院,https://travel.qunar.com/p-oi710603-gugongbowuyuan,北京,4.8,故宫旅游攻略,0,开放时间：旺季（4月1日 - 10月31日）8:30开放入馆，16:00停止入馆 ，17:00闭馆 ；淡季（11月1日 - 次年3月31日）8:30开放入馆，15:30停止入馆 ，16:30闭馆。每周一闭馆。🎫预约方式：提前7天在“故宫博物院”小程序预约，20:00开始放票。记得提前填写好个人信息，到点准时开抢，下手一定要快！同一证件每个参观日仅能预约一张门票 。门票限参观当日使用，不可改签、变更。🚇地铁路线：1号线天安门东...,2025-08-22,去哪儿用户,3
1,故宫博物院,https://travel.qunar.com/p-oi710603-gugongbowuyuan,北京,4.8,故宫 【门票】 淡季：40元/人（不包括珍宝馆、钟表馆） 推荐比较常规的几条路线，可供参考,5,"故宫旧称紫禁城,以三大殿为中心,占地面积72万平方米,建筑面积约15万平方米,有大小宫殿七十多座,收藏有105万件珍贵文物,规模较大、保存较为完整,是中国古代宫廷建筑之精华。所以在很短的时间里,很难将故宫全部参观完毕,一天也只够参观到其一部分,不得不感叹中国建筑之博大精深。作为中国人,一生中必去的地方。【门票】淡季：40元/人（不包括珍宝馆、钟表馆）；旺季：60元/人（不包括珍宝馆、钟表馆）；...",2019-08-19,赏味期限,3
1,故宫博物院,https://travel.qunar.com/p-oi710603-gugongbowuyuan,北京,4.8,故宫游玩攻略|没有淡季的故宫，出发前一定要准备好,5,第一次到紫禁城的游玩，一个字“累”，走断脚的一天，累并快乐着。皇宫大院太大了，看完“三宫六院”时脚都快废了。不得不说，紫禁城的建筑群气势雄伟，体量宏大！游玩紫禁城，不是说走马观花就可以走完，即使你匆匆游览一遍都得花上大半天时间。游玩紫禁城不可忽略的三个点：一是故宫游玩的路线，二是故宫建筑群的细节， 比如 屋顶上的脊兽，三是故宫珍贵文物。紫禁城大，大到可以让你迷失方向，但你可以观察...,2019-09-17,小小鲫鱼,3
1,故宫博物院,https://travel.qunar.com/p-oi710603-gugongbowuyuan,北京,4.8,北京故宫是中国最有名的皇家宫殿，紫禁城是我心中最爱的宫殿，也是游览北京必去的景点。【温馨小贴士】,5,北京故宫是中国最有名的皇家宫殿，紫禁城是我心中最爱的宫殿，也是游览北京必去的景点。我通常都会带些吃食，在这里待上一天，去了多次也不觉得腻，我相信故宫有自己独一无二的魅力，才能吸引着中外众多游客。初入故宫大门，第一感觉便是十分震撼，多少宫殿烟雨中，金碧辉煌看不尽，我每年都会去一次故宫，每次都会让我流连忘返，春天看宫边柳梢初长嫩芽，夏天看凌霄花攀岩走壁，秋天看落叶萧瑟纷落，冬天看...,2018-02-21,zr清清,3
1,故宫博物院,https://travel.qunar.com/p-oi710603-gugongbowuyuan,北京,4.8,种草故宫内的冷门景点（拍点不一样的）,5,故宫仿佛已经成为北京或者中国的第一打卡点了。今天想要分享一下，同样都是去故宫怎么拍点不一样的素材呢？推荐场所：📍1.珍宝馆🔷推荐理由：珍宝馆因为是单独付费的，所以经常都会被人们忽略。觉得十块钱可能也看不到什么东西？或是因为走正常线路就错过了珍宝馆？但其实这十块钱真的太值了！答应我一定要去。除了有之前宫里的摆件玉石还有后宫娘娘们曾经戴过的头饰等等。女孩纸在这里真的一点都挪...,2019-12-04,Cc,3
1,故宫博物院,https://travel.qunar.com/p-oi710603-gugongbowuyuan,北京,4.8,推荐百度故宫博物院在网上买电子票，在去的前一天的14点之前买，这样进去的时候就可以直接刷身份证...,5,周六去的故宫，每年11月到3月属于淡季，门票就只要60，如果是其余时间的话就是80元的门票；学生证买票可以半价，别的一些证件也有可以半价的；tips：推荐百度故宫博物院在网上买电子票，在去的前一天的14点之前买，这样进去的时候就可以直接刷身份证进去不用排队取票什么的特别方便，而且你可以在网上退票或者更改日期如果临时有事去不了的话，非常方便；做地铁是在北京游玩最实惠最方便的一种方式，去故宫的...,2015-04-01,longmayshereign,3
1,故宫博物院,https://travel.qunar.com/p-oi710603-gugongbowuyuan,北京,4.8,故宫游览攻略,5,无论何时去北京，故宫都是我最心仪最想去的地方。故宫博物院建立于1925年，是在明朝、清朝两代皇宫及其收藏的基础上建立起来的中国综合性博物馆，是中国最大的古代文化艺术博物馆，世界上现存规模最大的宫殿建筑群，国内最早列入世界遗产名录的景区之一。无论淡旺季都是上午8点半开门，下午5点前清场。一定避开节假日去，平日游客都多，且只有一半多面积开放，热门建筑如三大殿都不能进，隔栏观赏拥挤不堪...,2019-10-18,小可看世界,3
1,故宫博物院,https://travel.qunar.com/p-oi710603-gugongbowuyuan,北京,4.8,御花园在宫廷剧中常常是皇家女人们最爱搞事情的地方，动不动就“戏精”附体，上演一出宫斗大戏,5,我和闺蜜提前3天在网上订票，避开了开宫门时鱼贯而入的汹涌人潮，相约周末晌午带着身份证开启深宫之旅。令人惊喜的是，午后的紫禁城比想象中要安静许多，三三两两的游客并不会影响与宫廷建筑合影。路线：午门→太和门→太和殿→中和殿→保和殿→乾清宫→交泰殿→坤宁宫→西六宫区→东六宫区→御花园→神武门走在后宫宫墙内，时常看到姑娘们匆忙寻找东西六宫的打卡目的地，听到小声讨论眼前的宫殿是在哪一...,2018-09-01,HiHolidays,3
1,故宫博物院,https://travel.qunar.com/p-oi710603-gugongbowuyuan,北京,4.8,②参观故宫的时候最好租个讲解器，方便了解历史，以免走马观花。温馨提示：①故宫全年实行周一下午闭馆,5,【故宫、恢宏的皇家建筑】故宫，旧称紫禁城，是中国规模最大、保存最完好的皇家建筑。本人去过故宫两次，均是从南往北，沿中轴线游览。故宫的建筑从整体上感受气势恢宏，从细节之处体会又不乏精美。故宫的建筑群讲究对称，从南向北主要有午门、太和门、太和殿、中和殿、保和殿、乾清宫、交泰殿、坤宁宫、御花园、神武门。故宫旺季门票60元，学生票20元，淡季40元，不包括珍宝馆（10元）和钟表馆（10元）。故宫...,2015-07-07,刘小明2012,3
1,故宫博物院,https://travel.qunar.com/p-oi710603-gugongbowuyuan,北京,4.8,给我十分钟，带您梦回大明,5,北京城1406年开始盖，盖了16年，1420年完工，朱棣他老人家是1421年正月搬过来的，所以我们会说故宫600岁啦。毕竟是明朝开始使用的紫禁城，所以lilith坚持穿了明制的汉服来，比起清宫服装，也是凉快了不少呢。📷故宫如何拍？如今故宫放开到了8000人。但也几乎等于没人。我是约的下午场，13点到的，刚好是大顶光。于是在大家都不喜欢大顶光的时候，我就在三大殿拍上了，这时候道具扇子就可以派上用场，挡挡...,2020-05-20,lilith,3
1,故宫博物院,https://travel.qunar.com/p-oi710603-gugongbowuyuan,北京,4.8,解锁网红故宫一日游,5,在众多5A景区中，故宫绝对是最良心的一个。故宫也是一个来过多少次都不会腻的地方。故宫，原名紫禁城，曾是的皇室重地，一堵高墙分隔了两个世界。有的人进了皇宫一辈子就再无法踏出一步，有的人一辈子都无法目睹高墙里的世界。来到北京，一定要亲眼目睹曾经的皇城。故宫，每年，都有数千万中外游客来到故宫参观游览。想要在人山人海的故宫中排出空无一人的感觉，有几个要点🔊1.故宫早上一开门就准时进...,2019-12-05,Tone_mll,3
1,故宫博物院,https://travel.qunar.com/p-oi710603-gugongbowuyuan,北京,4.8,...的时间，毕竟人多拍哪哪都不好看，每次拍照想没有人必须倾斜角度来拍，要不都拍不出稍微好看点的照片,5,"#北京旅游#故宫博物院地址：北京市东城区景山前街4号开放时间：8:00～17:00（周一闭馆）门票价格：旺季60.00元 淡季40.00元著名景点：午门,东华门,太和门三大殿建议游玩时长：3-4小时适宜季节：9月-10月自打小有意识的时候就知道，来北京必来的地方就是故宫博物院。红墙黄瓦映入眼帘，以严肃、庄严、壮丽、雄伟的形象出现在我眼前，这些都是当时以象征皇帝的至高无上的权力的方式。故宫是一个...",2018-09-13,Sivian占占,3
1,故宫博物院,https://travel.qunar.com/p-oi710603-gugongbowuyuan,北京,4.8,来北京玩，故宫自然就是第一打卡地方。,5,同学来北京玩，故宫自然就是第一打卡地方。写在前面几点小TIPS1：不需要买讲解器，百度地图自带讲解方便。2：我们下地铁，走一段路。到一个宫殿门口，会有摆渡车10元到门口，不建议坐，走过去很近就1公里，人多时候似乎2元2元可以坐。3：各个旅行网站买票即可，建议买下午场，直接刷身份证进去即可，最后出来，没有人，随随便便拍照都是大片。4:一定要拿身份证，我就是第一次忘了拿身份证，哈哈哈。5：...,2018-09-10,景德镇本地人地陪潘海…,3
1,故宫博物院,https://travel.qunar.com/p-oi710603-gugongbowuyuan,北京,4.8,总之，故宫是必须值得去的地方，而且要细细参观,5,故宫博物院是中国最具代表性最出名的景点，从每天的客流量和外国游客的数量就看得出来。要说故宫可是有太多说的了，我已经去了两次，明年还打算去第三次，因为里边真的很大，有的宫殿还限时开放，一次根本看不全。交通坐地铁一号线天安门东、天安门西下都行，公交车四通八达的，查查手机地图好了。故宫的唯一入口是午门，就是在天安门进去，出口是神武门和东华门。每年4月1日到10月31日是旺季，票价是60元，其...,2015-01-30,Michael1989,3
1,故宫博物院,https://travel.qunar.com/p-oi710603-gugongbowuyuan,北京,4.8,故宫内还有两个单独收费的展馆，珍宝馆和钟表馆，看自己的兴趣选择参观,5,对故宫有着谜一般的热情，自从来北京读书现在一年半多去故宫的次数没有十次也得有九次。不知道去哪就去故宫，天气好去故宫，下雪去故宫，朋友来京带朋友去故宫，有特展去故宫，总之总是有理由去溜达一圈，可能因为取得多了现在也并不觉得它面积大了。但说实话我对于故宫历史的了解可能还不如甄嬛传的剧迷，那个皇上哪个妃子，干什么的地方基本上都还是模棱两可，这点我很惭愧，因为实在对历史没啥兴趣，故宫吸...,2019-01-22,一笑有俩小酒窝,3
1,故宫博物院,https://travel.qunar.com/p-oi710603-gugongbowuyuan,北京,4.8,故宫冰棍来啦 神兽造型拍照打卡必备,5,故宫新晋网红，人气替代故宫咖啡的故宫雪糕来啦。10元一支的故宫冰棍故宫雪糕，在故宫里冰窖餐厅（临近慈宁宫）和故宫餐厅（临近钟表馆）可以买到。目前见过的颜色味道大概是奶油巧克力抹茶芒果味，味道还不错，淡淡的奶油味。色彩斑斓拍照好看，打卡的话推荐大家买绿色或黄色的拍照，搭配红墙背景很醒目，拿着手机拍就很可爱，瑞兽造型酷似缩小版的石狮子，古风古韵，很有文化特色。去故宫玩可以买一个故...,2019-12-05,秦菜芹菜摄影师,3
1,故宫博物院,https://travel.qunar.com/p-oi710603-gugongbowuyuan,北京,4.8,🧱望红墙看尽千年沉浮| 故宫博物院快速进入秘籍,5,故宫，旧称紫禁城，是中国明清两代皇家宫殿，更是中国古代宫廷建筑的精华～更是重要的世界文化遗产～如今北京故宫博物院如今已经成了新晋网红，现在教你尽量避开人人人人人人人人的情况，让你快速进故宫！🔜‼️如何快速进入故宫‼️🚇地铁1号线坐到天安门西，从B出口出来：避开拥挤的天安门，从长安街进入南长街，然后再从中山公园西门入口进入（💰门票：3元）公园里空气超好哦～按照导航从公园的...,2019-09-28,美美麻麻Mona,3
1,故宫博物院,https://travel.qunar.com/p-oi710603-gugongbowuyuan,北京,4.8,珍宝馆于1958年开馆，是故宫博物院重要的常年开馆的陈列馆之一,4,珍宝馆于1958年开馆，是故宫博物院重要的常年开馆的陈列馆之一。各色宝石汇聚于此，金银玉器，珍珠翡翠等各类珍宝举世无双。,2018-09-26,小鲁面,3
1,故宫博物院,https://travel.qunar.com/p-oi710603-gugongbowuyuan,北京,4.8,"#十月出游指南 国庆旅游可以去的 8大热门景点
去天安门广",0,#十月出游指南 国庆旅游可以去的 8大热门景点去天安门广场看升旗去婺源，看篁岭晒秋去武功山，看云海翻滚去额济纳，看胡杨林去乌镇，看江南水乡去新疆，感受喀纳斯秋天的美去稻城看金秋美景。去北海涠洲岛，感受浪漫与休闲国庆节你最想去哪？到评论区里一起分享吧。,2022-08-07,不二旅行,0
1,故宫博物院,https://travel.qunar.com/p-oi710603-gugongbowuyuan,北京,4.8,故宫的深秋是什么样子？,0,2020.11.19今日天气晴好，再次来到故宫寻找深秋残留的秋色。由于天气好游人很多，需要注意的来时一定要在网上预约门票。游览时也要早些来，因为疫情需要激活门票，一定要有北京健康码。我显然是来晚了，但深秋的景色依然美。,2020-11-24,空谷幽兰摄影,0
1,故宫博物院,https://travel.qunar.com/p-oi710603-gugongbowuyuan,北京,4.8,神武门，东华门，只作为参观出口。答案：务必呆到闭馆前半小时！南片区人会很少。答案：不可以哦,5,问题1⃣️：为了避开人流，我想反向从景山那个门进入可以吗？答案：不可以哦！观众一律从只能从午门进入故宫；神武门，东华门，只作为参观出口。问题2⃣️🌟：如何拍到无人的故宫？答案：务必呆到闭馆前半小时！南片区人会很少。或者早起党进去之后快速杀到东西六宫。（转自若谷小姐姐）有些人多的地方，等一等也会出现一阵子突然没人的情况。问题3⃣️：行李可以寄存吗？答案：可以。而且故宫可以从...,2020-02-26,行者信也,3
1,故宫博物院,https://travel.qunar.com/p-oi710603-gugongbowuyuan,北京,4.8,宝藏迷踪：珍宝馆里的秘密与传说！,0,宝藏迷踪：故宫珍宝馆里的秘密与传说 🕵️‍♀️在宁寿宫的深处，隐藏着一段不为人知的历史。那些璀璨的珍宝，每一件都有一个传奇的故事。🌟想象一下，那些金银玉器、古瓷名画，它们不仅仅是历史的见证，更是无数匠人智慧的结晶。每一个细节，都仿佛在诉说着那个时代的风云变幻。🏺🎨而关于这些珍宝，民间更是流传着各种神秘的传说。有的说，某个珍宝中隐藏着一个重大的秘密；有的说，这里曾是某个...,2024-01-29,旅行韵律,3
1,故宫博物院,https://travel.qunar.com/p-oi710603-gugongbowuyuan,北京,4.8,故宫一日游攻略：穿越紫禁城，邂逅六百年风华,0,故宫一日游攻略：穿越紫禁城，邂逅六百年风华“一座紫禁城，半部中国史。”北京故宫，这座始建于永乐年间的皇家宫殿，不仅是明清两代的政治中心，更是中华文明的瑰宝。作为世界上现存规模最大、保存最完整的古代宫殿建筑群，它以红墙黄瓦、飞檐翘角的壮美姿态，静静矗立在北京中轴线上，等待着每一位旅人前来叩响历史的大门。去年秋天，我怀着敬畏与期待，走进了这座“活的博物馆”，开启了一场穿越六百年的...,2025-10-18,Duck不必,3
1,故宫博物院,https://travel.qunar.com/p-oi710603-gugongbowuyuan,北京,4.8,终于见到了故宫的雪❄️经典不踩雷旅游攻略,0,终于见到了故宫的雪❄️经典不踩雷旅游攻略太幸运了，恰好在北京！北京难得有的大雪，被我赶上了！🏨住宿：我选择的是一家经济型酒店——xx快捷酒店。酒店位置便利，靠近地铁站和景点，价格实惠，而且设施齐全，就非常适合预算有限的旅行者。想要优惠的朋友可以评论区dd～🚶‍♂️三天行程安排：第丨天：早上到达北京，入住酒店后前往故宫博物院。故宫的雪景非常美，尤其是太下午可以去天安门广...,2023-12-21,跟我去旅行,3
1,故宫博物院,https://travel.qunar.com/p-oi710603-gugongbowuyuan,北京,4.8,去过很多次故宫，但你真的了解它吗？,5,故宫，旧称紫禁城，是在明清两代皇宫及其收藏的基础上建立起来的中国综合性博物馆，也是中国最大的古代文化艺术博物馆。一重宫门，两重世界，红墙金瓦，映照这历史尘埃，听不完千年物语，说不完皇城浮沉……吃烤鸭，爬长城，秀才带您游北京！推荐一下我们秀才说讲解品牌。秀才说专注北京历史古迹深度讲解，并且有多位历史专业为背景的学者型讲解员，年服务游客达35万余人，好评率高达99%，秀才说·网红团队...,2021-12-24,秀才说,3
1,故宫博物院,https://travel.qunar.com/p-oi710603-gugongbowuyuan,北京,4.8,揭秘珍宝馆：珍稀宝物的迷人世界！,0,揭秘珍宝馆：走进故宫宁寿宫，探寻珍稀宝物的迷人世界！✨故宫宁寿宫，一个充满神秘色彩的地方，珍藏着无数珍稀宝物。这里的每一件宝物都有着独特的故事和魅力，让人不禁为之倾倒。😍走进宁寿宫，首先映入眼帘的是一座巨大的翡翠玉雕，晶莹剔透，栩栩如生。相传这是乾隆皇帝亲自督造的宝物，耗费了大量人力物力，成为了中国工艺史上的瑰宝。🗿继续前行，你会看到一串串精美的珍珠项链，颗颗珍珠浑圆饱...,2024-01-29,旅行韵律,3
1,故宫博物院,https://travel.qunar.com/p-oi710603-gugongbowuyuan,北京,4.8,答应我一定去看故宫秋色（附路线,0,答应我一定去看故宫秋色（附路线|||故宫秋景上线，加载进度70%图片拍摄于11.12日，最近天气甚好，秋景主要为银杏以及高大的柿子树，配上红墙，十分出片。也是参考网上大神们的攻略，如果是赏秋拍摄可以按照这个线路来，图片顺序也是按照游览顺序放的：东华门-东南角楼-午门-延禧宫-寿康宫-慈宁花园-冰窖-十八槐-东华门具体赏秋分布：1⃣️东南角楼：有一些银杏分布，60%黄2⃣️延禧宫：两颗银杏，一颗1...,2024-01-26,跟我去旅行,3
1,故宫博物院,https://travel.qunar.com/p-oi710603-gugongbowuyuan,北京,4.8,故宫内的钟表馆绝对值得一去（另加10元门票）。忘了这是哪里，总之故宫内很多地方是不能参观的,3,身份证取票。乌泱泱的人潮啊。中间路线上，很难得拍到一张人少一点的。不知道哪里，但是觉得很适合练剑。这里，老妈看着十几米高的围墙感慨：甄嬛当时就是在这里拍的吧。我说：她们在横店拍的。。。故宫其实比我想象的要小很多，东西12宫有4个当时在维护，1座宫内没几间寝室，可能之前电视剧拍得太好了，错觉严重。忘了这是哪里，总之故宫内很多地方是不能参观的。故宫内的钟表馆绝对值得一去（另加10元门票）...,2016-07-31发表于游记2016.3 北京，第一次去北方城市,sunpark,3
1,故宫博物院,https://travel.qunar.com/p-oi710603-gugongbowuyuan,北京,4.8,(推荐淡季前往，门票价格低，人比旺季少好多，由于故宫每天有人数限制，在网上买票的直接刷身份证就...,5,【故宫简介^_^】故宫又叫紫禁城，中国保存最完整，规模最大的木质结构古建筑群，是世界五大宫之首。故宫分为“外朝”和“内庭”。外朝以太和殿，中和殿，保和殿为中心。是帝皇行使权利，举行庆典的地方。内庭以乾清宫，交泰殿，坤宁宫为中心，以及东西两侧的东六宫和西六宫，也就是俗称的“三宫六院”。距今已经有六百多年的历史了。故宫内的珍贵文物约占全国文物总数的六分之一。【关于交通^_^】故宫位于北京...,2016-10-06,姚龙峰丶,3
